[
  {
    "title": "La Mascarade du boucher",
    "series": "Dungeon Crawler Carl",
    "authors": [
      "Matt Dinniman"
    ],
    "rating": 4,
    "volume": "5/7",
    "comment": "Relecture, mais en français",
    "date": "2026-10",
    "fiction": true,
    "cover": "/assets/books/dungeon-crawler-carl-5.jpg",
    "format": "print"
  },
  {
    "title": "Le Portail des dieux infernaux",
    "series": "Dungeon Crawler Carl",
    "authors": [
      "Matt Dinniman"
    ],
    "rating": 4,
    "volume": "4/7",
    "comment": "Relecture, mais en français",
    "date": "2026-09",
    "fiction": true,
    "cover": "/assets/books/dungeon-crawler-carl-4.jpg",
    "format": "print"
  },
  {
    "title": "Des fleurs pour Algernon",
    "authors": [
      "Daniel Keyes"
    ],
    "rating": 3,
    "comment": "Suranné, long, triste, et j'ai presque préféré la genèse du roman raconté par l'auteur que le roman en édition augmentée",
    "date": "2026-09",
    "fiction": true,
    "cover": "/assets/books/des-fleurs-pour-algernon.jpg",
    "format": "print"
  },
  {
    "title": "Ultra-intelligence",
    "subtitle": "Jusqu'où iront les IA ?",
    "authors": [
      "Aymeric Roucher"
    ],
    "rating": 3,
    "comment": "1ère partie avec une bonne intro aux LLM, puis des questions \"sociétales\" sans être très profondes. J'ai préféré \"IA - Faut-il décider\"",
    "date": "2026-09",
    "fiction": false,
    "cover": "/assets/books/ultra-intelligence.jpg",
    "format": "print"
  },
  {
    "title": "Rose de sang",
    "series": "Wyld",
    "authors": [
      "Nicholas Eames"
    ],
    "rating": 2,
    "volume": "2/2",
    "comment": "Vraiment pas de surprise, presqu'un peu bête, creux. J'ai vraiment eu du mal à le finir",
    "date": "2026-09",
    "fiction": true,
    "cover": "/assets/books/wyld-2.jpg",
    "format": "print"
  },
  {
    "title": "Travail",
    "authors": [
      "Marie-Anne Dujarier"
    ],
    "rating": 3,
    "comment": "Court. Pas pris de note, mais des quelques points intéressants.",
    "date": "2026-09",
    "fiction": false,
    "cover": "/assets/books/travail.jpg",
    "format": "print"
  },
  {
    "title": "La Mort ou la Gloire",
    "series": "Wyld",
    "authors": [
      "Nicholas Eames"
    ],
    "rating": 3,
    "volume": "1/2",
    "comment": "On me l'avait bien vendu, mais les personnages, d'anciens héros, bof, mais ça marche quand-même",
    "date": "2026-08",
    "fiction": true,
    "cover": "/assets/books/wyld-1.jpg",
    "format": "print"
  },
  {
    "title": "Destruction",
    "series": "Wayward Pines",
    "authors": [
      "Blake Crouch"
    ],
    "rating": 4,
    "volume": "3/3",
    "date": "2026-08",
    "fiction": true,
    "cover": "/assets/books/wayward-pines-3.jpg",
    "format": "print"
  },
  {
    "title": "Rébellion",
    "series": "Wayward Pines",
    "authors": [
      "Blake Crouch"
    ],
    "rating": 4,
    "volume": "2/3",
    "date": "2026-08",
    "fiction": true,
    "cover": "/assets/books/wayward-pines-2.jpg",
    "format": "print"
  },
  {
    "title": "Révélation",
    "series": "Wayward Pines",
    "authors": [
      "Blake Crouch"
    ],
    "rating": 4,
    "volume": "1/3",
    "comment": "Je ne voyais pas comment l'auteur allait écrire un tome 2 et 3, mais tout se tient. Haletant (surtout ce 1er tome)",
    "date": "2026-08",
    "fiction": true,
    "cover": "/assets/books/wayward-pines-1.jpg",
    "format": "print"
  },
  {
    "title": "La Ville des voleurs",
    "authors": [
      "David Benioff"
    ],
    "rating": 4,
    "comment": "La faim, les péripéties, la Russie... Super ! Et cette chute finale !",
    "date": "2026-08",
    "fiction": true,
    "cover": "/assets/books/la-ville-des-voleurs.jpg",
    "format": "print"
  },
  {
    "title": "Les Terres de Cristal",
    "series": "Le Puits des Mémoires",
    "authors": [
      "Gabriel Katz"
    ],
    "rating": 4,
    "volume": "3/3",
    "date": "2026-08",
    "fiction": true,
    "cover": "/assets/books/le-puits-des-memoires-3.jpg",
    "format": "print"
  },
  {
    "title": "Le Fils de la Lune",
    "series": "Le Puits des Mémoires",
    "authors": [
      "Gabriel Katz"
    ],
    "rating": 4,
    "volume": "2/3",
    "date": "2026-08",
    "fiction": true,
    "cover": "/assets/books/le-puits-des-memoires-2.jpg",
    "format": "print"
  },
  {
    "title": "La Traque",
    "series": "Le Puits des Mémoires",
    "authors": [
      "Gabriel Katz"
    ],
    "rating": 4,
    "volume": "1/3",
    "comment": "De l'aventure ! Ok, la perte de mémoire est facile, mais justifiée après. Vraiment pas mal.",
    "date": "2026-08",
    "fiction": true,
    "cover": "/assets/books/le-puits-des-memoires-1.jpg",
    "format": "print"
  },
  {
    "title": "Ne tirez pas sur l'oiseur moqueur",
    "authors": [
      "Harper Lee"
    ],
    "rating": 4,
    "comment": "Il faut avoir un peu de contexte pour le lire et mieux l'apprécier, mais c'est un bon roman.",
    "date": "2026-07",
    "fiction": true,
    "cover": "/assets/books/ne-tirez-pas-sur-loiseur-moqueur.jpg",
    "format": "print"
  },
  {
    "title": "Penser avec clarté",
    "subtitle": "L'art et la science de la bonne prise de décision",
    "authors": [
      "Shane Parrish"
    ],
    "rating": 3,
    "comment": "De bonnes pages, mais pas un guide/mémo. Où sont les vraies pépites ?",
    "date": "2026-07",
    "fiction": false,
    "cover": "/assets/books/penser-avec-clarte.jpg",
    "format": "print"
  },
  {
    "title": "Le livre de recettes de l'anarchiste",
    "series": "Dungeon Crawler Carl",
    "authors": [
      "Matt Dinniman"
    ],
    "rating": 4,
    "volume": "3/7",
    "comment": "Relecture, mais en français",
    "date": "2026-07",
    "fiction": true,
    "cover": "/assets/books/dungeon-crawler-carl-3.jpg",
    "format": "print"
  },
  {
    "title": "L'ogive du jugement dernier",
    "series": "Dungeon Crawler Carl",
    "authors": [
      "Matt Dinniman"
    ],
    "rating": 4,
    "volume": "2/7",
    "comment": "Relecture, mais en français",
    "date": "2026-07",
    "fiction": true,
    "cover": "/assets/books/dungeon-crawler-carl-2.jpg",
    "format": "print"
  },
  {
    "title": "Les tambours du dieu noir",
    "authors": [
      "P. Djèlí Clark"
    ],
    "rating": 4,
    "comment": "Très bien, bien écrit",
    "date": "2026-06",
    "fiction": true,
    "cover": "/assets/books/les-tambours-du-dieu-noir.jpg",
    "format": "print"
  },
  {
    "title": "Une très bonne hérétique",
    "authors": [
      "Becky Chambers"
    ],
    "rating": 4,
    "comment": "Des nouvelles, dont une dans le cycle des voyageurs. Toujours très bon",
    "date": "2026-06",
    "fiction": true,
    "cover": "/assets/books/une-tres-bonne-heretique.jpg",
    "format": "print"
  },
  {
    "title": "Lonesome Dove",
    "authors": [
      "Larry McMurtry"
    ],
    "rating": 5,
    "volume": "1/2",
    "comment": "Ces personnages, l'humour, l'ambiance. Tout est bon !",
    "date": "2026-06",
    "fiction": true,
    "cover": "/assets/books/lonesome-dove-1.jpg",
    "format": "print"
  },
  {
    "title": "Primal Hunter",
    "authors": [
      "Zogarth"
    ],
    "rating": 2,
    "volume": "1/?",
    "comment": "LitRPG, mais creux. Je mets 2 sur 5 pour la progression. C'est un sous Dungeon Crawler Carl. Je ne lirai pas la suite. C'est mou, mal décrit, pas inventif, mal raconté",
    "date": "2026-06",
    "fiction": true,
    "cover": "/assets/books/primal-hunter-1.jpg",
    "format": "print"
  },
  {
    "title": "La loi de la tartine beurrée",
    "authors": [
      "J.M. Erre"
    ],
    "rating": 3,
    "comment": "Sympatoche, moins original que les autres",
    "date": "2026-05",
    "fiction": true,
    "cover": "/assets/books/la-loi-de-la-tartine-beurree.jpg",
    "format": "print"
  },
  {
    "title": "Faut-il encore décider",
    "authors": [
      "Eric Hazan",
      "Olivier Sibony"
    ],
    "rating": 4,
    "comment": "Bons arguments, bonne exploration sur les décisions à l'ère de l'IA.",
    "date": "2026-05",
    "fiction": false,
    "cover": "/assets/books/faut-il-encore-decider.jpg",
    "format": "print"
  },
  {
    "title": "Mais c'est un complot",
    "authors": [
      "Benjamin Brillaud",
      "François Hatt"
    ],
    "rating": 4,
    "date": "2026-05",
    "fiction": false,
    "cover": "/assets/books/mais-c-est-un-complot.jpg",
    "format": "audiobook"
  },
  {
    "title": "Vision aveugle",
    "authors": [
      "Peter Watts"
    ],
    "rating": 3,
    "comment": "Plutot pas mal, un peu confus, mais c'est fais exprès. Hard-science.",
    "date": "2026-05",
    "fiction": true,
    "cover": "/assets/books/vision-aveugle.jpg",
    "format": "print"
  },
  {
    "title": "La tragique histoire de la grande guerre",
    "authors": [
      "Jean-Yves Le Naour"
    ],
    "rating": 4,
    "comment": "La première guerre mondiale, son déroulement, ses atrocités. Bien, sans se noyer dans les détails. Quel gachis. Et ces jeux entre alliés.",
    "date": "2026-05",
    "fiction": false,
    "cover": "/assets/books/la-tragique-histoire-de-la-grande-guerre.jpg",
    "format": "audiobook"
  },
  {
    "title": "Mars Express - Tem",
    "authors": [
      "Cédric Degottex"
    ],
    "rating": 4,
    "comment": "Bon cyberpunk, préquel du bon film \"Mars Express\". Je n'aime pas trop les héros torturé alcoolique (trop vus ?), mais l'univers est bon",
    "date": "2026-05",
    "fiction": true,
    "cover": "/assets/books/mars-express-tem.jpg",
    "format": "print"
  },
  {
    "title": "Sur le chemin des cathédrales",
    "authors": [
      "Henri D'Anselme"
    ],
    "rating": 3,
    "comment": "Mi-randonnée, mi-découverte des cathédrales. Aurait pu être beaucoup didactique. Trop autour de l'auteur ? En tout cas, j'ai appris de petites choses",
    "date": "2026-05",
    "fiction": false,
    "cover": "/assets/books/sur-le-chemin-des-cathedrales.jpg",
    "format": "print"
  },
  {